{
  "$schema": "https://json-schema.org/draft/2020-12/schema",
  "$id": "https://slipr.local/schema/show.schema.json",
  "title": "Slipr show",
  "description": "A Slipr show (show.json), format version 0.1. Spec: docs/show-format.md",
  "type": "object",
  "required": ["slipr", "id", "meta", "template", "slides"],
  "additionalProperties": false,
  "properties": {
    "$schema": { "type": "string", "description": "Optional pointer to this schema, for editor autocomplete." },
    "slipr": { "const": "0.1", "description": "Show format version." },
    "id": { "$ref": "#/$defs/kebabId", "description": "Stable show identifier (kebab-case)." },
    "meta": { "$ref": "#/$defs/meta" },
    "template": { "$ref": "#/$defs/templateRef" },
    "settings": { "$ref": "#/$defs/settings" },
    "chapters": {
      "type": "array",
      "description": "Chapters in display order.",
      "items": { "$ref": "#/$defs/chapter" }
    },
    "glossary": {
      "type": "object",
      "description": "Glossary terms by id. Referenced in Markdown as [[id]] or [[id|text]].",
      "propertyNames": { "$ref": "#/$defs/id" },
      "additionalProperties": { "$ref": "#/$defs/glossaryTerm" }
    },
    "profiles": {
      "type": "array",
      "description": "Reader profiles that blocks can be targeted at with 'for'.",
      "items": { "$ref": "#/$defs/profile" }
    },
    "paths": {
      "type": "array",
      "description": "Curated routes through the show for reader mode.",
      "items": { "$ref": "#/$defs/path" }
    },
    "slides": {
      "type": "array",
      "minItems": 1,
      "items": { "$ref": "#/$defs/slide" }
    }
  },

  "$defs": {
    "id": {
      "type": "string",
      "pattern": "^[A-Za-z0-9][A-Za-z0-9_-]*$",
      "description": "Identifier: letters, digits, '-' and '_', starting with a letter or digit."
    },
    "kebabId": {
      "type": "string",
      "pattern": "^[a-z0-9]+(-[a-z0-9]+)*$",
      "description": "Lower-case kebab-case identifier."
    },
    "markdown": {
      "type": "string",
      "description": "Slipr Markdown subset: **bold**, *italic*, `code`, [link](url), - lists, [[glossary]], ^[popup], [text](#slide-id)."
    },

    "meta": {
      "type": "object",
      "required": ["title"],
      "additionalProperties": false,
      "properties": {
        "title": { "type": "string", "minLength": 1 },
        "subtitle": { "type": "string" },
        "author": { "type": "string" },
        "date": { "type": "string", "pattern": "^\\d{4}-\\d{2}-\\d{2}$", "description": "ISO date, YYYY-MM-DD." },
        "language": { "type": "string", "pattern": "^[a-zA-Z]{2,3}(-[a-zA-Z0-9]{2,8})*$", "description": "BCP-47 language tag, e.g. en or nl-NL." },
        "description": { "type": "string" },
        "tags": { "type": "array", "items": { "type": "string" } }
      }
    },

    "templateRef": {
      "type": "object",
      "required": ["ref"],
      "additionalProperties": false,
      "properties": {
        "ref": { "type": "string", "minLength": 1, "description": "Path or URL of the template folder, relative to show.json." },
        "version": { "type": "string", "description": "Semver range the show was made for, e.g. ^1.0." }
      }
    },

    "settings": {
      "type": "object",
      "additionalProperties": false,
      "properties": {
        "aspectRatio": { "enum": ["16:9", "4:3"] },
        "transition": { "$ref": "#/$defs/transition" },
        "slideNumbers": { "type": "boolean" },
        "agenda": { "type": "boolean", "description": "Audience mode: insert a generated agenda slide before each chapter." }
      }
    },
    "transition": { "enum": ["none", "fade", "slide", "convex", "concave", "zoom"] },

    "chapter": {
      "type": "object",
      "required": ["id", "title"],
      "additionalProperties": false,
      "properties": {
        "id": { "$ref": "#/$defs/id" },
        "title": { "type": "string", "minLength": 1 },
        "summary": { "type": "string" }
      }
    },

    "glossaryTerm": {
      "type": "object",
      "required": ["term", "definition"],
      "additionalProperties": false,
      "properties": {
        "term": { "type": "string", "minLength": 1 },
        "definition": { "$ref": "#/$defs/markdown" },
        "link": { "type": "string" }
      }
    },

    "profile": {
      "type": "object",
      "required": ["id", "label"],
      "additionalProperties": false,
      "properties": {
        "id": { "$ref": "#/$defs/id" },
        "label": { "type": "string", "minLength": 1 },
        "description": { "type": "string" }
      }
    },

    "path": {
      "type": "object",
      "required": ["id", "label", "slides"],
      "additionalProperties": false,
      "properties": {
        "id": { "$ref": "#/$defs/id" },
        "label": { "type": "string", "minLength": 1 },
        "description": { "type": "string" },
        "slides": {
          "description": "Slide ids in order, or \"*\" for all slides.",
          "anyOf": [
            { "const": "*" },
            { "type": "array", "minItems": 1, "items": { "$ref": "#/$defs/id" } }
          ]
        }
      }
    },

    "slide": {
      "type": "object",
      "required": ["id", "layout", "content"],
      "additionalProperties": false,
      "properties": {
        "id": { "$ref": "#/$defs/id" },
        "layout": { "$ref": "#/$defs/id", "description": "Layout id from the template." },
        "chapter": { "$ref": "#/$defs/id" },
        "tags": { "type": "array", "items": { "type": "string" } },
        "content": {
          "type": "object",
          "description": "Audience layer: slot name -> slot value. Slot types come from the template layout.",
          "propertyNames": { "$ref": "#/$defs/id" },
          "additionalProperties": { "$ref": "#/$defs/slotValue" }
        },
        "notes": { "$ref": "#/$defs/markdown" },
        "audience": { "$ref": "#/$defs/audience" },
        "reader": { "$ref": "#/$defs/reader" },
        "_orphaned": {
          "type": "object",
          "description": "Editor-internal: slot values kept after a layout switch, restored when switching back."
        }
      }
    },

    "slotValue": {
      "anyOf": [
        { "type": "string" },
        { "type": "array", "items": { "type": "string" } },
        { "$ref": "#/$defs/image" },
        { "$ref": "#/$defs/code" },
        { "$ref": "#/$defs/quote" },
        { "$ref": "#/$defs/chart" },
        { "$ref": "#/$defs/diagram" },
        { "$ref": "#/$defs/cards" }
      ]
    },
    "cards": {
      "type": "array",
      "description": "Value of a 'cards' slot: one object per card. Field names and types come from the template's slot definition.",
      "items": {
        "type": "object",
        "propertyNames": { "$ref": "#/$defs/id" },
        "additionalProperties": {
          "anyOf": [
            { "type": "string" },
            { "$ref": "#/$defs/image" }
          ]
        }
      }
    },
    "image": {
      "type": "object",
      "required": ["src"],
      "additionalProperties": false,
      "properties": {
        "src": { "type": "string", "minLength": 1, "description": "Relative to show.json, e.g. images/x.png." },
        "alt": { "type": "string" },
        "fit": { "enum": ["contain", "cover"] },
        "focus": { "type": "string", "description": "CSS object-position, e.g. center or 30% 50%." }
      }
    },
    "code": {
      "type": "object",
      "required": ["code"],
      "additionalProperties": false,
      "properties": {
        "language": { "type": "string" },
        "code": { "type": "string" }
      }
    },
    "quote": {
      "type": "object",
      "required": ["text"],
      "additionalProperties": false,
      "properties": {
        "text": { "type": "string" },
        "source": { "type": "string" }
      }
    },
    "chart": {
      "type": "object",
      "required": ["kind", "data"],
      "description": "(planned) Data-driven chart.",
      "properties": {
        "kind": { "type": "string" },
        "data": { "type": "object" }
      }
    },
    "diagram": {
      "type": "object",
      "required": ["mermaid"],
      "additionalProperties": false,
      "description": "(planned) Mermaid diagram.",
      "properties": {
        "mermaid": { "type": "string" }
      }
    },

    "audience": {
      "type": "object",
      "additionalProperties": false,
      "properties": {
        "hidden": { "type": "boolean", "description": "Backup slide: skipped while presenting, reachable via the overview." },
        "fragments": {
          "description": "Reveal list items one by one; true or a Reveal fragment style.",
          "anyOf": [
            { "type": "boolean" },
            { "enum": ["fade-in", "fade-up", "fade-down", "fade-left", "fade-right", "fade-in-then-semi-out", "semi-fade-out", "grow", "shrink"] }
          ]
        },
        "autoAnimate": { "type": "boolean", "description": "Morph matching elements into the next/previous auto-animate slide." },
        "transition": { "$ref": "#/$defs/transition" },
        "background": { "type": "string", "description": "CSS color or image path (relative to show.json)." }
      }
    },

    "reader": {
      "type": "object",
      "additionalProperties": false,
      "properties": {
        "hidden": { "type": "boolean", "description": "Leave this slide out of reader mode." },
        "showSlide": { "type": "boolean", "description": "Show the slide visual above the blocks (default true)." },
        "summary": { "type": "string", "description": "One-line takeaway." },
        "blocks": { "type": "array", "items": { "$ref": "#/$defs/block" } },
        "related": { "type": "array", "items": { "$ref": "#/$defs/id" } }
      }
    },

    "block": {
      "description": "Reader block; the 'type' field selects the block kind.",
      "anyOf": [
        { "$ref": "#/$defs/blockText" },
        { "$ref": "#/$defs/blockDetails" },
        { "$ref": "#/$defs/blockCallout" },
        { "$ref": "#/$defs/blockTabs" },
        { "$ref": "#/$defs/blockImage" },
        { "$ref": "#/$defs/blockEmbed" },
        { "$ref": "#/$defs/blockSlideRef" }
      ]
    },
    "for": { "type": "array", "minItems": 1, "items": { "$ref": "#/$defs/id" }, "description": "Profile ids that see this block; absent = everyone." },
    "depth": { "enum": [1, 2, 3], "description": "1 essential, 2 standard (default), 3 deep dive." },

    "blockText": {
      "type": "object",
      "required": ["id", "type", "md"],
      "additionalProperties": false,
      "properties": {
        "id": { "$ref": "#/$defs/id" }, "type": { "const": "text" },
        "for": { "$ref": "#/$defs/for" }, "depth": { "$ref": "#/$defs/depth" },
        "md": { "$ref": "#/$defs/markdown" }
      }
    },
    "blockDetails": {
      "type": "object",
      "required": ["id", "type", "title", "md"],
      "additionalProperties": false,
      "properties": {
        "id": { "$ref": "#/$defs/id" }, "type": { "const": "details" },
        "for": { "$ref": "#/$defs/for" }, "depth": { "$ref": "#/$defs/depth" },
        "title": { "type": "string", "minLength": 1 },
        "md": { "$ref": "#/$defs/markdown" },
        "open": { "type": "boolean" }
      }
    },
    "blockCallout": {
      "type": "object",
      "required": ["id", "type", "variant", "md"],
      "additionalProperties": false,
      "properties": {
        "id": { "$ref": "#/$defs/id" }, "type": { "const": "callout" },
        "for": { "$ref": "#/$defs/for" }, "depth": { "$ref": "#/$defs/depth" },
        "variant": { "enum": ["info", "tip", "warning", "quote"] },
        "title": { "type": "string" },
        "md": { "$ref": "#/$defs/markdown" }
      }
    },
    "blockTabs": {
      "type": "object",
      "required": ["id", "type", "tabs"],
      "additionalProperties": false,
      "properties": {
        "id": { "$ref": "#/$defs/id" }, "type": { "const": "tabs" },
        "for": { "$ref": "#/$defs/for" }, "depth": { "$ref": "#/$defs/depth" },
        "tabs": {
          "type": "array",
          "minItems": 1,
          "items": {
            "type": "object",
            "required": ["label", "md"],
            "additionalProperties": false,
            "properties": {
              "label": { "type": "string", "minLength": 1 },
              "md": { "$ref": "#/$defs/markdown" }
            }
          }
        }
      }
    },
    "blockImage": {
      "type": "object",
      "required": ["id", "type", "image"],
      "additionalProperties": false,
      "properties": {
        "id": { "$ref": "#/$defs/id" }, "type": { "const": "image" },
        "for": { "$ref": "#/$defs/for" }, "depth": { "$ref": "#/$defs/depth" },
        "image": { "$ref": "#/$defs/image" },
        "caption": { "type": "string" },
        "hotspots": {
          "type": "array",
          "items": {
            "type": "object",
            "required": ["x", "y", "title", "md"],
            "additionalProperties": false,
            "properties": {
              "x": { "type": "number", "minimum": 0, "maximum": 1 },
              "y": { "type": "number", "minimum": 0, "maximum": 1 },
              "title": { "type": "string", "minLength": 1 },
              "md": { "$ref": "#/$defs/markdown" }
            }
          }
        }
      }
    },
    "blockEmbed": {
      "type": "object",
      "required": ["id", "type", "url", "title"],
      "additionalProperties": false,
      "properties": {
        "id": { "$ref": "#/$defs/id" }, "type": { "const": "embed" },
        "for": { "$ref": "#/$defs/for" }, "depth": { "$ref": "#/$defs/depth" },
        "url": { "type": "string", "minLength": 1, "description": "Absolute URL, or path relative to show.json." },
        "title": { "type": "string", "minLength": 1 },
        "height": { "type": "integer", "minimum": 100 }
      }
    },
    "blockSlideRef": {
      "type": "object",
      "required": ["id", "type", "slide"],
      "additionalProperties": false,
      "properties": {
        "id": { "$ref": "#/$defs/id" }, "type": { "const": "slide-ref" },
        "for": { "$ref": "#/$defs/for" }, "depth": { "$ref": "#/$defs/depth" },
        "slide": { "$ref": "#/$defs/id" },
        "label": { "type": "string" }
      }
    }
  }
}
