{
  "$schema": "../../../shared/schema/show.schema.json",
  "slipr": "0.1",
  "id": "impact-autonomy-agents-lucasjellema-20260930",
  "meta": {
    "title": "titel slide (afbeelding)",
    "author": "Lucas Jellema",
    "date": "2026-10-04",
    "language": "en"
  },
  "template": {
    "ref": "../../../templates/conclusion",
    "version": "^0.1"
  },
  "settings": {
    "aspectRatio": "16:9",
    "transition": "fade",
    "slideNumbers": true
  },
  "chapters": [
    {
      "id": "default-section",
      "title": "Default Section"
    },
    {
      "id": "background",
      "title": "background"
    }
  ],
  "slides": [
    {
      "id": "s-01",
      "layout": "title-image",
      "chapter": "default-section",
      "content": {
        "title": "Fundament voor autonome (agentic) systemen",
        "byline": "Lucas Jellema, CTO Conclusion",
        "image": {
          "src": "images/slide01-1.jpg",
          "alt": ""
        }
      }
    },
    {
      "id": "s-02",
      "layout": "text",
      "chapter": "default-section",
      "content": {
        "title": "Dat doet ‘ie anders nooit hoor.."
      },
      "notes": "_[Converter] Not converted from PowerPoint: media._"
    },
    {
      "id": "s-03",
      "layout": "text",
      "chapter": "default-section",
      "content": {
        "title": "De mens (en het bedrijf) achter de agent",
        "kicker": "Baasje is de baas (of in elk geval verantwoordelijk)"
      },
      "reader": {
        "blocks": [
          {
            "id": "converted-image-1",
            "type": "image",
            "image": {
              "src": "images/slide03-1.png",
              "alt": ""
            }
          }
        ]
      }
    },
    {
      "id": "s-04",
      "layout": "text",
      "chapter": "default-section",
      "content": {
        "title": "De mens (en het bedrijf) achter de agent",
        "kicker": "Baasje is de baas (of in elk geval verantwoordelijk)"
      },
      "reader": {
        "blocks": [
          {
            "id": "converted-image-1",
            "type": "image",
            "image": {
              "src": "images/slide03-1.png",
              "alt": ""
            }
          },
          {
            "id": "converted-image-2",
            "type": "image",
            "image": {
              "src": "images/slide04-2.png",
              "alt": ""
            }
          }
        ]
      }
    },
    {
      "id": "s-05",
      "layout": "text",
      "chapter": "default-section",
      "content": {},
      "reader": {
        "blocks": [
          {
            "id": "converted-image-1",
            "type": "image",
            "image": {
              "src": "images/slide05-1.png",
              "alt": ""
            }
          },
          {
            "id": "converted-image-2",
            "type": "image",
            "image": {
              "src": "images/slide05-2.png",
              "alt": ""
            }
          }
        ]
      }
    },
    {
      "id": "s-06",
      "layout": "text",
      "chapter": "default-section",
      "content": {},
      "reader": {
        "blocks": [
          {
            "id": "converted-image-1",
            "type": "image",
            "image": {
              "src": "images/slide05-1.png",
              "alt": ""
            }
          }
        ]
      }
    },
    {
      "id": "s-07",
      "layout": "text",
      "chapter": "default-section",
      "content": {},
      "reader": {
        "blocks": [
          {
            "id": "converted-image-1",
            "type": "image",
            "image": {
              "src": "images/slide07-1.jpg",
              "alt": "Burgerlijk Wetboek | 9789013055566 | Onbekend | Boeken | bol"
            }
          },
          {
            "id": "converted-image-2",
            "type": "image",
            "image": {
              "src": "images/slide05-1.png",
              "alt": ""
            }
          },
          {
            "id": "converted-image-3",
            "type": "image",
            "image": {
              "src": "images/slide07-3.png",
              "alt": ""
            }
          }
        ]
      }
    },
    {
      "id": "s-08",
      "layout": "text",
      "chapter": "default-section",
      "content": {
        "title": "AI Act"
      },
      "reader": {
        "blocks": [
          {
            "id": "converted-image-1",
            "type": "image",
            "image": {
              "src": "images/slide08-1.png",
              "alt": ""
            }
          },
          {
            "id": "converted-image-2",
            "type": "image",
            "image": {
              "src": "images/slide08-2.png",
              "alt": ""
            }
          },
          {
            "id": "converted-image-3",
            "type": "image",
            "image": {
              "src": "images/slide08-3.png",
              "alt": ""
            }
          },
          {
            "id": "converted-image-4",
            "type": "image",
            "image": {
              "src": "images/slide08-4.png",
              "alt": ""
            }
          }
        ]
      }
    },
    {
      "id": "s-09",
      "layout": "text",
      "chapter": "default-section",
      "content": {
        "title": "AI Act"
      },
      "reader": {
        "blocks": [
          {
            "id": "converted-image-1",
            "type": "image",
            "image": {
              "src": "images/slide08-1.png",
              "alt": ""
            }
          },
          {
            "id": "converted-image-2",
            "type": "image",
            "image": {
              "src": "images/slide08-3.png",
              "alt": ""
            }
          },
          {
            "id": "converted-image-3",
            "type": "image",
            "image": {
              "src": "images/slide08-4.png",
              "alt": ""
            }
          }
        ]
      }
    },
    {
      "id": "s-10",
      "layout": "text",
      "chapter": "default-section",
      "content": {
        "title": "Autonomous ai agentic systeem",
        "kicker": "Toenemende autonomie & besluitvorming",
        "body": "Digitale Medewerker, Doel (wat & waarom), HOTL, initiatief en handelingsvrijheid,\n\nAutonomie + gedelegeerde verantwoordelijkheid\n\nAssistent, Instructie (hoe), HITL, direct toezicht en ingrijpen"
      },
      "reader": {
        "blocks": [
          {
            "id": "converted-image-1",
            "type": "image",
            "image": {
              "src": "images/slide10-1.jpg",
              "alt": ""
            }
          }
        ]
      }
    },
    {
      "id": "s-11",
      "layout": "text-image",
      "chapter": "default-section",
      "content": {
        "title": "Waarom willen we autonome agents?",
        "body": "- Snelheid\n- 24/7\n- Onvermoeibaarheid\n- Schaalbaarheid\n- Kosten?\n- Kwaliteit?\n- Flexibiliteit\n- Diepgang\n- Onhaalbare haalbaar\n- Schaarste personeel\n- Medewerkers vrijspelen voor belangrijk werk  – waar EI nodig is\n- AI washing?"
      },
      "audience": {
        "fragments": true
      },
      "reader": {
        "blocks": [
          {
            "id": "converted-image-1",
            "type": "image",
            "image": {
              "src": "images/slide10-1.jpg",
              "alt": ""
            }
          }
        ]
      }
    },
    {
      "id": "s-12",
      "layout": "text",
      "chapter": "default-section",
      "content": {
        "title": "Het 5D model: Basis van een AI Agent",
        "kicker": "Wat is een AI Agent?",
        "body": "- **Doel** – wat moet de agent bereiken\n- **Denken** – LLM / reasoning\n- **Doen** – tools / acties & waarnemen\n- **Dossier** – uitgangspunt, context & geheugen\n- **Dirigent** – orkestratie / regie, al klaar / wat nu?"
      },
      "audience": {
        "fragments": true
      },
      "reader": {
        "blocks": [
          {
            "id": "converted-text-1",
            "type": "text",
            "md": "**D**\n\n**D**\n\n**D**\n\n**D**\n\n**D**"
          },
          {
            "id": "converted-image-1",
            "type": "image",
            "image": {
              "src": "images/slide12-1.jpg",
              "alt": "5D Realities (@5DRealities) • Facebook"
            }
          }
        ]
      }
    },
    {
      "id": "s-13",
      "layout": "text",
      "chapter": "default-section",
      "content": {
        "title": "Het 5D model: Basis van een AI Agent",
        "kicker": "Wat is een AI Agent?",
        "body": "- **Doel** – wat moet de agent bereiken\n- **Denken** – LLM / reasoning\n- **Doen** – tools / acties & waarnemen\n- **Dossier** – uitgangspunt, context & geheugen\n- **Dirigent** – orkestratie / regie, al klaar / wat nu?"
      },
      "reader": {
        "blocks": [
          {
            "id": "converted-text-1",
            "type": "text",
            "md": "**D**\n\n**D**\n\n**D**\n\n**D**\n\n**D**"
          },
          {
            "id": "converted-image-1",
            "type": "image",
            "image": {
              "src": "images/slide12-1.jpg",
              "alt": "5D Realities (@5DRealities) • Facebook"
            }
          },
          {
            "id": "converted-image-2",
            "type": "image",
            "image": {
              "src": "images/slide13-2.png",
              "alt": ""
            }
          }
        ]
      }
    },
    {
      "id": "s-14",
      "layout": "text",
      "chapter": "default-section",
      "content": {
        "title": "Waar zit Risico van autonoom gedrag?",
        "body": "- Als de stagiaire de telefoon pakt, het internet op gaat, apparatuur gaat bedienen, over het terrein gaat dwalen"
      },
      "reader": {
        "blocks": [
          {
            "id": "converted-image-1",
            "type": "image",
            "image": {
              "src": "images/slide14-1.png",